{"actor":"BUILDER","operation_id":"op-d42c07eaf6cb9a0d4972d3c03058ad4a3e67fbb488aa2b1953d056f5ba10951b","report_path":"C:\\Users\\fael\\AppData\\Local\\Temp\\o0_v2_m4_work\\reports\\builder-report.json","report_sha256":"e349fd2cbda077a6fb07a131e351dc9836fd768aa0b4b28f748706fb30e4480b","result":{"approval":null,"audit_round":0,"audit_target_sha":"4beaaaaf0bf0800e829cc5dbd00088943d1575ed","auditor_executor_id":null,"blocked_reason":null,"builder_branch":"main","builder_executor_id":"queue-builder","builder_head_sha":"4beaaaaf0bf0800e829cc5dbd00088943d1575ed","gate":"NONE","human_gate_required":true,"last_audit_report":null,"last_audit_report_sha256":null,"last_audit_result":null,"last_audited_sha":null,"last_builder_report":"C:\\Users\\fael\\AppData\\Local\\Temp\\o0_v2_m4_work\\reports\\builder-report.json","machine_state":"READY_FOR_AUDIT","max_audit_rounds":3,"message":"Audit target frozen at 4beaaaaf0bf0800e829cc5dbd00088943d1575ed.","next_actor":"AUDITOR","phase":"O0","product_authority_id":"owner","project_id":"ideias-standard","run_id":"run-a204cbe5ab562574f197b71d5ecce1337f7749dabb1d4d016fe0a6935c31e8a5","schema_version":"0.1","updated_at":"2026-09-16T23:30:16.570818+00:00"},"schema_version":"0.1","source":{"actor":"BUILDER","audit_round":0,"audit_target_sha":null,"builder_head_sha":null,"last_audited_sha":null,"machine_state":"READY_FOR_BUILD","run_id":"run-a204cbe5ab562574f197b71d5ecce1337f7749dabb1d4d016fe0a6935c31e8a5"}}