{"actor":"BUILDER","operation_id":"op-eaaa774bec53cd3f678c1959197f36ae9cc43cd08cab98939898f5d50c24ef44","report_path":"C:\\Users\\fael\\AppData\\Local\\Temp\\o0-v2-m5-work\\reports\\builder-report.json","report_sha256":"51dd60f768b60af415af38c5720855ddd7c3ff11fbb84aadd254a52dde49f08f","result":{"approval":null,"audit_round":0,"audit_target_sha":"eb11e1ddcf07b415201cdd49ee81d3b416bd2c6b","auditor_executor_id":null,"blocked_reason":null,"builder_branch":"main","builder_executor_id":"antigravity-cli","builder_head_sha":"eb11e1ddcf07b415201cdd49ee81d3b416bd2c6b","gate":"NONE","human_gate_required":true,"last_audit_report":null,"last_audit_report_sha256":null,"last_audit_result":null,"last_audited_sha":null,"last_builder_report":"C:\\Users\\fael\\AppData\\Local\\Temp\\o0-v2-m5-work\\reports\\builder-report.json","machine_state":"READY_FOR_AUDIT","max_audit_rounds":3,"message":"Audit target frozen at eb11e1ddcf07b415201cdd49ee81d3b416bd2c6b.","next_actor":"AUDITOR","phase":"O0","product_authority_id":"owner","project_id":"ideias-standard","run_id":"run-97973bd215003ae5c5b33c1c4301081cc561c2e0b5576185ca63b2ace612dc00","schema_version":"0.1","updated_at":"2026-09-17T00:47:22.561675+00:00"},"schema_version":"0.1","source":{"actor":"BUILDER","audit_round":0,"audit_target_sha":null,"builder_head_sha":null,"last_audited_sha":null,"machine_state":"READY_FOR_BUILD","run_id":"run-97973bd215003ae5c5b33c1c4301081cc561c2e0b5576185ca63b2ace612dc00"}}