{"actor":"AUDITOR","operation_id":"op-6efe19fb216d6cbca3ffeeb6b35f1df7cd5b981fa17d05ca4700ce45b1ee5a0b","report_path":"C:\\Users\\fael\\Documents\\Codex\\2026-09-14\\ideias-o0-v2-m2-process-run-final\\reports\\audit-report.json","report_sha256":"acbe35fce2ffb7407974cfcbc2e2d6c007dc5bf39fcb3a07bbf64f47201d16d0","result":{"approval":null,"audit_round":1,"audit_target_sha":"c3897fde5fe6a6bca5d9a3b811a0d0f4ab79203f","auditor_executor_id":"codex-cli","blocked_reason":null,"builder_branch":"main","builder_executor_id":"antigravity-cli","builder_head_sha":"c3897fde5fe6a6bca5d9a3b811a0d0f4ab79203f","gate":"NONE","human_gate_required":true,"last_audit_report":"C:\\Users\\fael\\Documents\\Codex\\2026-09-14\\ideias-o0-v2-m2-process-run-final\\reports\\audit-report.json","last_audit_report_sha256":"acbe35fce2ffb7407974cfcbc2e2d6c007dc5bf39fcb3a07bbf64f47201d16d0","last_audit_result":"PASS","last_audited_sha":"c3897fde5fe6a6bca5d9a3b811a0d0f4ab79203f","last_builder_report":"C:\\Users\\fael\\Documents\\Codex\\2026-09-14\\ideias-o0-v2-m2-process-run-final\\reports\\builder-report.json","machine_state":"WAITING_PRODUCT_AUTHORITY","max_audit_rounds":3,"message":"Independent audit passed for the frozen SHA. Automation must stop until explicit Product Authority gate registration.","next_actor":"PRODUCT_AUTHORITY","phase":"O0","product_authority_id":"configured-product-authority","project_id":"o0-v2-m2-project","run_id":"run-65f08ff607c9d916afe60b94bb392be048fa5070d3e54cf01c58abad1c9b7d0e","schema_version":"0.1","updated_at":"2026-09-16T20:46:48.161450+00:00"},"schema_version":"0.1","source":{"actor":"AUDITOR","audit_round":0,"audit_target_sha":"c3897fde5fe6a6bca5d9a3b811a0d0f4ab79203f","builder_head_sha":"c3897fde5fe6a6bca5d9a3b811a0d0f4ab79203f","last_audited_sha":null,"machine_state":"READY_FOR_AUDIT","run_id":"run-65f08ff607c9d916afe60b94bb392be048fa5070d3e54cf01c58abad1c9b7d0e"}}