{"actor":"AUDITOR","operation_id":"op-3e5d0a48c940a4d00a683de8dc3aedf0b627e676f833e0866f95ebfbb70ca208","report_path":"C:\\Users\\fael\\AppData\\Local\\Temp\\o0-v2-m5-work\\reports\\audit-report.json","report_sha256":"a072c781fc5af773059e25cbfa7bb3aec290df8dd9b089d318ee314333e963a3","result":{"approval":null,"audit_round":1,"audit_target_sha":"eb11e1ddcf07b415201cdd49ee81d3b416bd2c6b","auditor_executor_id":"codex-cli","blocked_reason":null,"builder_branch":"main","builder_executor_id":"antigravity-cli","builder_head_sha":"eb11e1ddcf07b415201cdd49ee81d3b416bd2c6b","gate":"NONE","human_gate_required":true,"last_audit_report":"C:\\Users\\fael\\AppData\\Local\\Temp\\o0-v2-m5-work\\reports\\audit-report.json","last_audit_report_sha256":"a072c781fc5af773059e25cbfa7bb3aec290df8dd9b089d318ee314333e963a3","last_audit_result":"PASS","last_audited_sha":"eb11e1ddcf07b415201cdd49ee81d3b416bd2c6b","last_builder_report":"C:\\Users\\fael\\AppData\\Local\\Temp\\o0-v2-m5-work\\reports\\builder-report.json","machine_state":"WAITING_PRODUCT_AUTHORITY","max_audit_rounds":3,"message":"Independent audit passed for the frozen SHA. Automation must stop until explicit Product Authority gate registration.","next_actor":"PRODUCT_AUTHORITY","phase":"O0","product_authority_id":"owner","project_id":"ideias-standard","run_id":"run-97973bd215003ae5c5b33c1c4301081cc561c2e0b5576185ca63b2ace612dc00","schema_version":"0.1","updated_at":"2026-09-17T00:47:40.030333+00:00"},"schema_version":"0.1","source":{"actor":"AUDITOR","audit_round":0,"audit_target_sha":"eb11e1ddcf07b415201cdd49ee81d3b416bd2c6b","builder_head_sha":"eb11e1ddcf07b415201cdd49ee81d3b416bd2c6b","last_audited_sha":null,"machine_state":"READY_FOR_AUDIT","run_id":"run-97973bd215003ae5c5b33c1c4301081cc561c2e0b5576185ca63b2ace612dc00"}}