{"actor":"BUILDER","operation_id":"op-41e071d337e4a6e0822f827d6149101c52a3516ed881952c3f71295a09aa6d1c","report_path":"C:\\Users\\fael\\AppData\\Local\\Temp\\o0_v2_m4_work\\reports\\builder-report.json","report_sha256":"ddbea6bc5a2e6556cad9aef34526f65ed30f848b7e8469bd005e6037d6e6c471","result":{"approval":null,"audit_round":0,"audit_target_sha":"4636c6d710c73080172e4acafc3d2381b0fd3043","auditor_executor_id":null,"blocked_reason":null,"builder_branch":"main","builder_executor_id":"queue-builder","builder_head_sha":"4636c6d710c73080172e4acafc3d2381b0fd3043","gate":"NONE","human_gate_required":true,"last_audit_report":null,"last_audit_report_sha256":null,"last_audit_result":null,"last_audited_sha":null,"last_builder_report":"C:\\Users\\fael\\AppData\\Local\\Temp\\o0_v2_m4_work\\reports\\builder-report.json","machine_state":"READY_FOR_AUDIT","max_audit_rounds":3,"message":"Audit target frozen at 4636c6d710c73080172e4acafc3d2381b0fd3043.","next_actor":"AUDITOR","phase":"O0","product_authority_id":"owner","project_id":"ideias-standard","run_id":"run-b49a698a2bf0f7c1f55a469ceb3bbe99367b540bcf95d2cf4a9bf0bf0de8c878","schema_version":"0.1","updated_at":"2026-09-16T23:30:15.772434+00:00"},"schema_version":"0.1","source":{"actor":"BUILDER","audit_round":0,"audit_target_sha":null,"builder_head_sha":null,"last_audited_sha":null,"machine_state":"READY_FOR_BUILD","run_id":"run-b49a698a2bf0f7c1f55a469ceb3bbe99367b540bcf95d2cf4a9bf0bf0de8c878"}}