{"actor":"AUDITOR","operation_id":"op-1d5e4e6ba3572122cd2e91eb5d58b0b8d7914ba293fd11fab06e2a61d1001329","report_path":"C:\\Users\\fael\\AppData\\Local\\Temp\\o0-v2-m5-work\\reports\\audit-report.json","report_sha256":"9cfa893e235beaa2d736fa32ba20df6f92674f79e59d49fc2262afb19fadd8d5","result":{"approval":null,"audit_round":2,"audit_target_sha":"d48a01e15f193dc7db21773bbe3dd794328ad238","auditor_executor_id":"codex-cli","blocked_reason":null,"builder_branch":"main","builder_executor_id":"antigravity-cli","builder_head_sha":"d48a01e15f193dc7db21773bbe3dd794328ad238","gate":"NONE","human_gate_required":true,"last_audit_report":"C:\\Users\\fael\\AppData\\Local\\Temp\\o0-v2-m5-work\\reports\\audit-report.json","last_audit_report_sha256":"9cfa893e235beaa2d736fa32ba20df6f92674f79e59d49fc2262afb19fadd8d5","last_audit_result":"PASS","last_audited_sha":"d48a01e15f193dc7db21773bbe3dd794328ad238","last_builder_report":"C:\\Users\\fael\\AppData\\Local\\Temp\\o0-v2-m5-work\\reports\\builder-report.json","machine_state":"WAITING_PRODUCT_AUTHORITY","max_audit_rounds":3,"message":"Independent audit passed for the frozen SHA. Automation must stop until explicit Product Authority gate registration.","next_actor":"PRODUCT_AUTHORITY","phase":"O0","product_authority_id":"owner","project_id":"ideias-standard","run_id":"run-e706c725cc592ad75840dc28bbf77427cdf97bed92c977a4b71e2048de6a616d","schema_version":"0.1","updated_at":"2026-09-17T00:47:00.026422+00:00"},"schema_version":"0.1","source":{"actor":"AUDITOR","audit_round":1,"audit_target_sha":"d48a01e15f193dc7db21773bbe3dd794328ad238","builder_head_sha":"d48a01e15f193dc7db21773bbe3dd794328ad238","last_audited_sha":null,"machine_state":"READY_FOR_AUDIT","run_id":"run-e706c725cc592ad75840dc28bbf77427cdf97bed92c977a4b71e2048de6a616d"}}