{"actor":"BUILDER","operation_id":"op-e1afd67438700196ee0ddcf49541af81c27e8c3520b60a07843c8d9eb491a3c8","report_path":"C:\\Users\\fael\\AppData\\Local\\Temp\\o0-v2-m5-work\\m5-resume-proof\\builder-timeout\\interrupted\\reports\\builder-report.json","report_sha256":"9b64098c7e3a0970529fdd0c8e8edc603a26038dae9985d2f18050bcae48c0bd","result":{"approval":null,"audit_round":0,"audit_target_sha":"e4dffa9df3fe5429aefd47b5457aa2a69029532b","auditor_executor_id":null,"blocked_reason":null,"builder_branch":"main","builder_executor_id":"antigravity-cli","builder_head_sha":"e4dffa9df3fe5429aefd47b5457aa2a69029532b","gate":"NONE","human_gate_required":true,"last_audit_report":null,"last_audit_report_sha256":null,"last_audit_result":null,"last_audited_sha":null,"last_builder_report":"C:\\Users\\fael\\AppData\\Local\\Temp\\o0-v2-m5-work\\m5-resume-proof\\builder-timeout\\interrupted\\reports\\builder-report.json","machine_state":"READY_FOR_AUDIT","max_audit_rounds":3,"message":"Audit target frozen at e4dffa9df3fe5429aefd47b5457aa2a69029532b.","next_actor":"AUDITOR","phase":"O0","product_authority_id":"configured-product-authority","project_id":"interruption-builder-timeout","run_id":"run-4c21fd3e865c4595dc70d9979aa4b28aacdee1d0e723dc5a20674daf59941d95","schema_version":"0.1","updated_at":"2026-09-17T00:57:59.821453+00:00"},"schema_version":"0.1","source":{"actor":"BUILDER","audit_round":0,"audit_target_sha":null,"builder_head_sha":null,"last_audited_sha":null,"machine_state":"READY_FOR_BUILD","run_id":"run-4c21fd3e865c4595dc70d9979aa4b28aacdee1d0e723dc5a20674daf59941d95"}}