{"actor":"AUDITOR","operation_id":"op-dc449a42842774bd4967eaf454aa28390e80a48e1b9ed2ae595a31b7ba02813a","report_path":"C:\\Users\\fael\\AppData\\Local\\Temp\\o0_v2_m3_work\\reports\\audit-report.json","report_sha256":"4fb358e9a2c879af9795c746b81739e13f00ff9908ed8156991c9e6794bdc6ec","result":{"approval":null,"audit_round":1,"audit_target_sha":"09b34e03c774009de69f761c3db8f69406a4ff1a","auditor_executor_id":"codex-cli","blocked_reason":null,"builder_branch":"main","builder_executor_id":"antigravity-cli","builder_head_sha":"09b34e03c774009de69f761c3db8f69406a4ff1a","gate":"NONE","human_gate_required":true,"last_audit_report":"C:\\Users\\fael\\AppData\\Local\\Temp\\o0_v2_m3_work\\reports\\audit-report.json","last_audit_report_sha256":"4fb358e9a2c879af9795c746b81739e13f00ff9908ed8156991c9e6794bdc6ec","last_audit_result":"FAIL","last_audited_sha":"09b34e03c774009de69f761c3db8f69406a4ff1a","last_builder_report":"C:\\Users\\fael\\AppData\\Local\\Temp\\o0_v2_m3_work\\reports\\builder-report.json","machine_state":"FIX_REQUIRED","max_audit_rounds":3,"message":"Audit failed; findings are ready for Builder correction.","next_actor":"BUILDER","phase":"O0","product_authority_id":"configured-product-authority","project_id":"o0-v2-m3-correction-cycle","run_id":"run-c0ebfc6bad6dab143c206953f31ad8c5c036f785ccdce7ccc02f571fab0aa040","schema_version":"0.1","updated_at":"2026-09-16T21:41:52.481565+00:00"},"schema_version":"0.1","source":{"actor":"AUDITOR","audit_round":0,"audit_target_sha":"09b34e03c774009de69f761c3db8f69406a4ff1a","builder_head_sha":"09b34e03c774009de69f761c3db8f69406a4ff1a","last_audited_sha":null,"machine_state":"READY_FOR_AUDIT","run_id":"run-c0ebfc6bad6dab143c206953f31ad8c5c036f785ccdce7ccc02f571fab0aa040"}}