{"actor":"AUDITOR","operation_id":"op-d72a8fd1e061e9c34f756fc88248da144c5639c74dbf062e29c6c884484659eb","report_path":"C:\\Users\\fael\\AppData\\Local\\Temp\\o0_v2_m4_work\\reports\\audit-report.json","report_sha256":"391fc390dc5c859afe5c9c8355e6b76c848839a957c123d336c426628d9d70ff","result":{"approval":null,"audit_round":1,"audit_target_sha":"4beaaaaf0bf0800e829cc5dbd00088943d1575ed","auditor_executor_id":"queue-auditor","blocked_reason":null,"builder_branch":"main","builder_executor_id":"queue-builder","builder_head_sha":"4beaaaaf0bf0800e829cc5dbd00088943d1575ed","gate":"NONE","human_gate_required":true,"last_audit_report":"C:\\Users\\fael\\AppData\\Local\\Temp\\o0_v2_m4_work\\reports\\audit-report.json","last_audit_report_sha256":"391fc390dc5c859afe5c9c8355e6b76c848839a957c123d336c426628d9d70ff","last_audit_result":"PASS","last_audited_sha":"4beaaaaf0bf0800e829cc5dbd00088943d1575ed","last_builder_report":"C:\\Users\\fael\\AppData\\Local\\Temp\\o0_v2_m4_work\\reports\\builder-report.json","machine_state":"WAITING_PRODUCT_AUTHORITY","max_audit_rounds":3,"message":"Independent audit passed for the frozen SHA. Automation must stop until explicit Product Authority gate registration.","next_actor":"PRODUCT_AUTHORITY","phase":"O0","product_authority_id":"owner","project_id":"ideias-standard","run_id":"run-a204cbe5ab562574f197b71d5ecce1337f7749dabb1d4d016fe0a6935c31e8a5","schema_version":"0.1","updated_at":"2026-09-16T23:30:16.967174+00:00"},"schema_version":"0.1","source":{"actor":"AUDITOR","audit_round":0,"audit_target_sha":"4beaaaaf0bf0800e829cc5dbd00088943d1575ed","builder_head_sha":"4beaaaaf0bf0800e829cc5dbd00088943d1575ed","last_audited_sha":null,"machine_state":"READY_FOR_AUDIT","run_id":"run-a204cbe5ab562574f197b71d5ecce1337f7749dabb1d4d016fe0a6935c31e8a5"}}