{"actor":"AUDITOR","operation_id":"op-5fd84a2456017ee3f72e2347f23199d68b63e80aa2fc3eda353c656a852a80a5","report_path":"C:\\Users\\fael\\AppData\\Local\\Temp\\o0_v2_m4_work\\reports\\audit-report.json","report_sha256":"bf48bc427c757408c00bf389dda990aa4cbf33af70ac0563ef792e90213a6808","result":{"approval":null,"audit_round":1,"audit_target_sha":"4636c6d710c73080172e4acafc3d2381b0fd3043","auditor_executor_id":"queue-auditor","blocked_reason":null,"builder_branch":"main","builder_executor_id":"queue-builder","builder_head_sha":"4636c6d710c73080172e4acafc3d2381b0fd3043","gate":"NONE","human_gate_required":true,"last_audit_report":"C:\\Users\\fael\\AppData\\Local\\Temp\\o0_v2_m4_work\\reports\\audit-report.json","last_audit_report_sha256":"bf48bc427c757408c00bf389dda990aa4cbf33af70ac0563ef792e90213a6808","last_audit_result":"PASS","last_audited_sha":"4636c6d710c73080172e4acafc3d2381b0fd3043","last_builder_report":"C:\\Users\\fael\\AppData\\Local\\Temp\\o0_v2_m4_work\\reports\\builder-report.json","machine_state":"WAITING_PRODUCT_AUTHORITY","max_audit_rounds":3,"message":"Independent audit passed for the frozen SHA. Automation must stop until explicit Product Authority gate registration.","next_actor":"PRODUCT_AUTHORITY","phase":"O0","product_authority_id":"owner","project_id":"ideias-standard","run_id":"run-b49a698a2bf0f7c1f55a469ceb3bbe99367b540bcf95d2cf4a9bf0bf0de8c878","schema_version":"0.1","updated_at":"2026-09-16T23:30:16.175532+00:00"},"schema_version":"0.1","source":{"actor":"AUDITOR","audit_round":0,"audit_target_sha":"4636c6d710c73080172e4acafc3d2381b0fd3043","builder_head_sha":"4636c6d710c73080172e4acafc3d2381b0fd3043","last_audited_sha":null,"machine_state":"READY_FOR_AUDIT","run_id":"run-b49a698a2bf0f7c1f55a469ceb3bbe99367b540bcf95d2cf4a9bf0bf0de8c878"}}