{"actor":"BUILDER","operation_id":"op-2b88b653e30444733e535aca711d377bb15341397288e3bfadd50fe368bd5c4f","report_path":"C:\\Users\\fael\\AppData\\Local\\Temp\\o0-v2-m5-work\\reports\\builder-report.json","report_sha256":"b4256ff1ccd4204e40ca8e5381ebf6a6b92d2b9f8da5f9458dc61f6e1a6ec073","result":{"approval":null,"audit_round":1,"audit_target_sha":"d48a01e15f193dc7db21773bbe3dd794328ad238","auditor_executor_id":"codex-cli","blocked_reason":null,"builder_branch":"main","builder_executor_id":"antigravity-cli","builder_head_sha":"d48a01e15f193dc7db21773bbe3dd794328ad238","gate":"NONE","human_gate_required":true,"last_audit_report":"C:\\Users\\fael\\AppData\\Local\\Temp\\o0-v2-m5-work\\reports\\audit-report.json","last_audit_report_sha256":"68475e6df0414e5c35e02a41cb8a4c4f45977f03ed251fb53e1b09b398214d98","last_audit_result":null,"last_audited_sha":null,"last_builder_report":"C:\\Users\\fael\\AppData\\Local\\Temp\\o0-v2-m5-work\\reports\\builder-report.json","machine_state":"READY_FOR_AUDIT","max_audit_rounds":3,"message":"Audit target frozen at d48a01e15f193dc7db21773bbe3dd794328ad238.","next_actor":"AUDITOR","phase":"O0","product_authority_id":"owner","project_id":"ideias-standard","run_id":"run-e706c725cc592ad75840dc28bbf77427cdf97bed92c977a4b71e2048de6a616d","schema_version":"0.1","updated_at":"2026-09-17T00:46:41.959502+00:00"},"schema_version":"0.1","source":{"actor":"BUILDER","audit_round":1,"audit_target_sha":"003d050af5186ad3efd39d729fc4ab3b888fd1a6","builder_head_sha":"003d050af5186ad3efd39d729fc4ab3b888fd1a6","last_audited_sha":"003d050af5186ad3efd39d729fc4ab3b888fd1a6","machine_state":"FIX_REQUIRED","run_id":"run-e706c725cc592ad75840dc28bbf77427cdf97bed92c977a4b71e2048de6a616d"}}