{"actor":"BUILDER","operation_id":"op-11aee49f5342f5e62c5463020fdcbf70bfaa47665846f1c896d08e4df1ec3a29","report_path":"C:\\Users\\fael\\AppData\\Local\\Temp\\o0-v2-m5-work\\reports\\builder-report.json","report_sha256":"55aab59ed77ca2183b5e8f0722e84d36eb235debbcffd45e7e920800fde9bda1","result":{"approval":null,"audit_round":0,"audit_target_sha":"003d050af5186ad3efd39d729fc4ab3b888fd1a6","auditor_executor_id":null,"blocked_reason":null,"builder_branch":"main","builder_executor_id":"antigravity-cli","builder_head_sha":"003d050af5186ad3efd39d729fc4ab3b888fd1a6","gate":"NONE","human_gate_required":true,"last_audit_report":null,"last_audit_report_sha256":null,"last_audit_result":null,"last_audited_sha":null,"last_builder_report":"C:\\Users\\fael\\AppData\\Local\\Temp\\o0-v2-m5-work\\reports\\builder-report.json","machine_state":"READY_FOR_AUDIT","max_audit_rounds":3,"message":"Audit target frozen at 003d050af5186ad3efd39d729fc4ab3b888fd1a6.","next_actor":"AUDITOR","phase":"O0","product_authority_id":"owner","project_id":"ideias-standard","run_id":"run-e706c725cc592ad75840dc28bbf77427cdf97bed92c977a4b71e2048de6a616d","schema_version":"0.1","updated_at":"2026-09-17T00:45:57.102168+00:00"},"schema_version":"0.1","source":{"actor":"BUILDER","audit_round":0,"audit_target_sha":null,"builder_head_sha":null,"last_audited_sha":null,"machine_state":"READY_FOR_BUILD","run_id":"run-e706c725cc592ad75840dc28bbf77427cdf97bed92c977a4b71e2048de6a616d"}}