{"actor":"AUDITOR","operation_id":"op-0a76987a215e9136ad67803999db5dc1ab75928eebe3c20bcf621559afc2785a","report_path":"A:\\ideias_standard\\.tmp_o0_m2_run\\reports\\audit-report.json","report_sha256":"11c40e7f2d2b56aca54ed3c74493f80cf523f14099e22f01b2bf4a1ae2659910","result":{"approval":null,"audit_round":1,"audit_target_sha":"ccc07302d508194cbd5885e2dd3fc8718d1d7127","auditor_executor_id":"codex-cli","blocked_reason":null,"builder_branch":"main","builder_executor_id":"antigravity-cli","builder_head_sha":"ccc07302d508194cbd5885e2dd3fc8718d1d7127","gate":"NONE","human_gate_required":true,"last_audit_report":"A:\\ideias_standard\\.tmp_o0_m2_run\\reports\\audit-report.json","last_audit_report_sha256":"11c40e7f2d2b56aca54ed3c74493f80cf523f14099e22f01b2bf4a1ae2659910","last_audit_result":"PASS","last_audited_sha":"ccc07302d508194cbd5885e2dd3fc8718d1d7127","last_builder_report":"A:\\ideias_standard\\.tmp_o0_m2_run\\reports\\builder-report.json","machine_state":"WAITING_PRODUCT_AUTHORITY","max_audit_rounds":3,"message":"Independent audit passed for the frozen SHA. Automation must stop until explicit Product Authority gate registration.","next_actor":"PRODUCT_AUTHORITY","phase":"O0","product_authority_id":"configured-product-authority","project_id":"o0-v2-m2-project","run_id":"run-65f08ff607c9d916afe60b94bb392be048fa5070d3e54cf01c58abad1c9b7d0e","schema_version":"0.1","updated_at":"2026-09-16T20:02:21.878983+00:00"},"schema_version":"0.1","source":{"actor":"AUDITOR","audit_round":0,"audit_target_sha":"ccc07302d508194cbd5885e2dd3fc8718d1d7127","builder_head_sha":"ccc07302d508194cbd5885e2dd3fc8718d1d7127","last_audited_sha":null,"machine_state":"READY_FOR_AUDIT","run_id":"run-65f08ff607c9d916afe60b94bb392be048fa5070d3e54cf01c58abad1c9b7d0e"}}