{"actor":"AUDITOR","operation_id":"op-7a3c3620b3c69b92c96536a97573137e247aaeb3a429202dc785e83da3b2761f","report_path":"C:\\Users\\fael\\AppData\\Local\\Temp\\o0_v2_m3_work\\reports\\audit-report.json","report_sha256":"8d693993040a4b0de5801dfb14447832265822a77665c127cab81e11e0cf1f4c","result":{"approval":null,"audit_round":2,"audit_target_sha":"d360c36033f3afc8b3210c861d9013223fefdf0a","auditor_executor_id":"codex-cli","blocked_reason":null,"builder_branch":"main","builder_executor_id":"antigravity-cli","builder_head_sha":"d360c36033f3afc8b3210c861d9013223fefdf0a","gate":"NONE","human_gate_required":true,"last_audit_report":"C:\\Users\\fael\\AppData\\Local\\Temp\\o0_v2_m3_work\\reports\\audit-report.json","last_audit_report_sha256":"8d693993040a4b0de5801dfb14447832265822a77665c127cab81e11e0cf1f4c","last_audit_result":"PASS","last_audited_sha":"d360c36033f3afc8b3210c861d9013223fefdf0a","last_builder_report":"C:\\Users\\fael\\AppData\\Local\\Temp\\o0_v2_m3_work\\reports\\builder-report.json","machine_state":"WAITING_PRODUCT_AUTHORITY","max_audit_rounds":3,"message":"Independent audit passed for the frozen SHA. Automation must stop until explicit Product Authority gate registration.","next_actor":"PRODUCT_AUTHORITY","phase":"O0","product_authority_id":"configured-product-authority","project_id":"o0-v2-m3-correction-cycle","run_id":"run-c0ebfc6bad6dab143c206953f31ad8c5c036f785ccdce7ccc02f571fab0aa040","schema_version":"0.1","updated_at":"2026-09-16T21:43:18.542117+00:00"},"schema_version":"0.1","source":{"actor":"AUDITOR","audit_round":1,"audit_target_sha":"d360c36033f3afc8b3210c861d9013223fefdf0a","builder_head_sha":"d360c36033f3afc8b3210c861d9013223fefdf0a","last_audited_sha":null,"machine_state":"READY_FOR_AUDIT","run_id":"run-c0ebfc6bad6dab143c206953f31ad8c5c036f785ccdce7ccc02f571fab0aa040"}}