{"actor":"BUILDER","operation_id":"op-f63b7c504e9c1916ff90af20b72a8702a6639e31ad37b7d7e27fe3dee9d12473","report_path":"C:\\Users\\fael\\AppData\\Local\\Temp\\o0_v2_m3_work\\reports\\builder-report.json","report_sha256":"ea95845b9d8e9b4b62c746e863ae63de318a3b0d565c770536779e6fa9991477","result":{"approval":null,"audit_round":0,"audit_target_sha":"09b34e03c774009de69f761c3db8f69406a4ff1a","auditor_executor_id":null,"blocked_reason":null,"builder_branch":"main","builder_executor_id":"antigravity-cli","builder_head_sha":"09b34e03c774009de69f761c3db8f69406a4ff1a","gate":"NONE","human_gate_required":true,"last_audit_report":null,"last_audit_report_sha256":null,"last_audit_result":null,"last_audited_sha":null,"last_builder_report":"C:\\Users\\fael\\AppData\\Local\\Temp\\o0_v2_m3_work\\reports\\builder-report.json","machine_state":"READY_FOR_AUDIT","max_audit_rounds":3,"message":"Audit target frozen at 09b34e03c774009de69f761c3db8f69406a4ff1a.","next_actor":"AUDITOR","phase":"O0","product_authority_id":"configured-product-authority","project_id":"o0-v2-m3-correction-cycle","run_id":"run-c0ebfc6bad6dab143c206953f31ad8c5c036f785ccdce7ccc02f571fab0aa040","schema_version":"0.1","updated_at":"2026-09-16T21:41:23.326347+00:00"},"schema_version":"0.1","source":{"actor":"BUILDER","audit_round":0,"audit_target_sha":null,"builder_head_sha":null,"last_audited_sha":null,"machine_state":"READY_FOR_BUILD","run_id":"run-c0ebfc6bad6dab143c206953f31ad8c5c036f785ccdce7ccc02f571fab0aa040"}}