{"actor":"BUILDER","operation_id":"op-fb97fb7b1ba0216c2199e108bb6b67ceb7cfa803d697f88234748343e23311f2","report_path":"A:\\ideias_standard\\.tmp_o0_m2_run\\reports\\builder-report.json","report_sha256":"31a14032fc574ef9740a241060855f65a93d86e0751abeebd2bba1fa24e64fb8","result":{"approval":null,"audit_round":0,"audit_target_sha":"ccc07302d508194cbd5885e2dd3fc8718d1d7127","auditor_executor_id":null,"blocked_reason":null,"builder_branch":"main","builder_executor_id":"antigravity-cli","builder_head_sha":"ccc07302d508194cbd5885e2dd3fc8718d1d7127","gate":"NONE","human_gate_required":true,"last_audit_report":null,"last_audit_report_sha256":null,"last_audit_result":null,"last_audited_sha":null,"last_builder_report":"A:\\ideias_standard\\.tmp_o0_m2_run\\reports\\builder-report.json","machine_state":"READY_FOR_AUDIT","max_audit_rounds":3,"message":"Audit target frozen at ccc07302d508194cbd5885e2dd3fc8718d1d7127.","next_actor":"AUDITOR","phase":"O0","product_authority_id":"configured-product-authority","project_id":"o0-v2-m2-project","run_id":"run-65f08ff607c9d916afe60b94bb392be048fa5070d3e54cf01c58abad1c9b7d0e","schema_version":"0.1","updated_at":"2026-09-16T20:01:48.966599+00:00"},"schema_version":"0.1","source":{"actor":"BUILDER","audit_round":0,"audit_target_sha":null,"builder_head_sha":null,"last_audited_sha":null,"machine_state":"READY_FOR_BUILD","run_id":"run-65f08ff607c9d916afe60b94bb392be048fa5070d3e54cf01c58abad1c9b7d0e"}}