{"actor":"BUILDER","operation_id":"op-d3e6b043100a8265a46e11bcbf64f58aa0260d19a77ba813fd11a81913f4eff7","report_path":"C:\\Users\\fael\\AppData\\Local\\Temp\\o0_v2_m3_work\\reports\\builder-report.json","report_sha256":"1cce89b22c361c8ef592f7824d5cf837cfd296f5f5d81b53e26e80efd25e960b","result":{"approval":null,"audit_round":1,"audit_target_sha":"d360c36033f3afc8b3210c861d9013223fefdf0a","auditor_executor_id":"codex-cli","blocked_reason":null,"builder_branch":"main","builder_executor_id":"antigravity-cli","builder_head_sha":"d360c36033f3afc8b3210c861d9013223fefdf0a","gate":"NONE","human_gate_required":true,"last_audit_report":"C:\\Users\\fael\\AppData\\Local\\Temp\\o0_v2_m3_work\\reports\\audit-report.json","last_audit_report_sha256":"4fb358e9a2c879af9795c746b81739e13f00ff9908ed8156991c9e6794bdc6ec","last_audit_result":null,"last_audited_sha":null,"last_builder_report":"C:\\Users\\fael\\AppData\\Local\\Temp\\o0_v2_m3_work\\reports\\builder-report.json","machine_state":"READY_FOR_AUDIT","max_audit_rounds":3,"message":"Audit target frozen at d360c36033f3afc8b3210c861d9013223fefdf0a.","next_actor":"AUDITOR","phase":"O0","product_authority_id":"configured-product-authority","project_id":"o0-v2-m3-correction-cycle","run_id":"run-c0ebfc6bad6dab143c206953f31ad8c5c036f785ccdce7ccc02f571fab0aa040","schema_version":"0.1","updated_at":"2026-09-16T21:42:20.860687+00:00"},"schema_version":"0.1","source":{"actor":"BUILDER","audit_round":1,"audit_target_sha":"09b34e03c774009de69f761c3db8f69406a4ff1a","builder_head_sha":"09b34e03c774009de69f761c3db8f69406a4ff1a","last_audited_sha":"09b34e03c774009de69f761c3db8f69406a4ff1a","machine_state":"FIX_REQUIRED","run_id":"run-c0ebfc6bad6dab143c206953f31ad8c5c036f785ccdce7ccc02f571fab0aa040"}}