{"actor":"AUDITOR","operation_id":"op-af6513b480f58c16ebe8bce2a8de612c034b9ddb2307142885a1c7dbb48f2585","report_path":"C:\\Users\\fael\\AppData\\Local\\Temp\\o0-v2-m5-work\\reports\\audit-report.json","report_sha256":"68475e6df0414e5c35e02a41cb8a4c4f45977f03ed251fb53e1b09b398214d98","result":{"approval":null,"audit_round":1,"audit_target_sha":"003d050af5186ad3efd39d729fc4ab3b888fd1a6","auditor_executor_id":"codex-cli","blocked_reason":null,"builder_branch":"main","builder_executor_id":"antigravity-cli","builder_head_sha":"003d050af5186ad3efd39d729fc4ab3b888fd1a6","gate":"NONE","human_gate_required":true,"last_audit_report":"C:\\Users\\fael\\AppData\\Local\\Temp\\o0-v2-m5-work\\reports\\audit-report.json","last_audit_report_sha256":"68475e6df0414e5c35e02a41cb8a4c4f45977f03ed251fb53e1b09b398214d98","last_audit_result":"FAIL","last_audited_sha":"003d050af5186ad3efd39d729fc4ab3b888fd1a6","last_builder_report":"C:\\Users\\fael\\AppData\\Local\\Temp\\o0-v2-m5-work\\reports\\builder-report.json","machine_state":"FIX_REQUIRED","max_audit_rounds":3,"message":"Audit failed; findings are ready for Builder correction.","next_actor":"BUILDER","phase":"O0","product_authority_id":"owner","project_id":"ideias-standard","run_id":"run-e706c725cc592ad75840dc28bbf77427cdf97bed92c977a4b71e2048de6a616d","schema_version":"0.1","updated_at":"2026-09-17T00:46:20.101620+00:00"},"schema_version":"0.1","source":{"actor":"AUDITOR","audit_round":0,"audit_target_sha":"003d050af5186ad3efd39d729fc4ab3b888fd1a6","builder_head_sha":"003d050af5186ad3efd39d729fc4ab3b888fd1a6","last_audited_sha":null,"machine_state":"READY_FOR_AUDIT","run_id":"run-e706c725cc592ad75840dc28bbf77427cdf97bed92c977a4b71e2048de6a616d"}}